calibration_id,metric_name,value,unit,decision_area,dataset_version,corpus_version,pipeline_version,experiment_run_id,git_commit,baseline_result,candidate_result,statistical_method,uncertainty_method,calibration_method,calibration_date,reviewer_or_approver,validity_period,recalibration_trigger,production_allowed
opportunity_score.weight_review_status,opportunity_weight_review_status,0.05,score_or_threshold,weight,internal-decision-inventory-2026-06-17,nvidia-corpus-versioned,product-final-proof,src/services/product/opportunity_score_service.py :: _W_REVIEW_STATUS = 0.05,workspace,not_recorded,Weight for review status in opportunity score.,uncalibrated,registered_decision_status,baseline_measurement,not_calibrated,team-scoring,until_recalibration_trigger,metric_formula_dataset_or_threshold_change,False
opportunity_score.weight_production_readiness,opportunity_weight_production_readiness,0.03,score_or_threshold,weight,internal-decision-inventory-2026-06-17,nvidia-corpus-versioned,product-final-proof,src/services/product/opportunity_score_service.py :: _W_PRODUCTION_READINESS = 0.03,workspace,not_recorded,Weight for production readiness in opportunity score. Smallest component.,uncalibrated,registered_decision_status,baseline_measurement,not_calibrated,team-scoring,until_recalibration_trigger,metric_formula_dataset_or_threshold_change,False
discovery.source_rate_limit_hint,discovery_source_rate_limit,5.0,score_or_threshold,limit,internal-decision-inventory-2026-06-17,nvidia-corpus-versioned,product-final-proof,src/discovery/source_registry.py :: DiscoverySource.rate_limit_hint = 5,workspace,not_recorded,Default rate limit hint (requests/second) for discovery sources. Hardcoded as dataclass default at source_registry.py:39. Can be overridden per source instance.,uncalibrated,registered_decision_status,baseline_measurement,not_calibrated,team-scraping,until_recalibration_trigger,metric_formula_dataset_or_threshold_change,False
agents.graph.business_impact_rag_weight,graph_biz_impact_rag_weight,0.4,score_or_threshold,weight,internal-decision-inventory-2026-06-17,nvidia-corpus-versioned,product-final-proof,src/agents/graph.py :: _build_rec_from_string :: 0.4,workspace,not_recorded,"Weight multiplier for RAG context presence in business_impact formula. Formula: 0.3 + 0.4 * (1.0 if rag_contexts else 0.0) + 0.3 * avg_quality. Hardcoded at graph.py:815. Sum = 1.0 when rag=1 and avg_quality=1. Range: [0.3, 1.0]. Most sensitive component: rag presence adds 0-0.4. Recommended calibration: sensitivity analysis vs downstream scoring metrics.",uncalibrated,registered_decision_status,sensitivity_analysis,not_calibrated,team-scoring,until_recalibration_trigger,metric_formula_dataset_or_threshold_change,False
agents.graph.business_impact_evidence_weight,graph_biz_impact_evidence_weight,0.3,score_or_threshold,weight,internal-decision-inventory-2026-06-17,nvidia-corpus-versioned,product-final-proof,src/agents/graph.py :: _build_rec_from_string :: 0.3,workspace,not_recorded,"Weight multiplier for avg_quality signal in business_impact formula. Hardcoded at graph.py:815. Scales with avg_quality in [0, 0.3]. Equal weight with base (both 0.3), less than rag (0.4).",uncalibrated,registered_decision_status,sensitivity_analysis,not_calibrated,team-scoring,until_recalibration_trigger,metric_formula_dataset_or_threshold_change,False
agents.graph.business_impact_base_weight,graph_biz_impact_base_weight,0.3,score_or_threshold,weight,internal-decision-inventory-2026-06-17,nvidia-corpus-versioned,product-final-proof,src/agents/graph.py :: _build_rec_from_string :: 0.3,workspace,not_recorded,"Base weight in business_impact formula. Always contributes 0.3 minimum. Hardcoded at graph.py:815. Even with no RAG and no evidence, score = 0.3.",uncalibrated,registered_decision_status,sensitivity_analysis,not_calibrated,team-scoring,until_recalibration_trigger,metric_formula_dataset_or_threshold_change,False
agents.graph.next_action_confidence_threshold,graph_next_action_confidence,0.7,score_or_threshold,threshold,internal-decision-inventory-2026-06-17,nvidia-corpus-versioned,product-final-proof,src/agents/graph.py :: _build_rec_from_string :: confidence >= 0.7,workspace,not_recorded,Threshold for switching next action wording between confident and exploratory. Hardcoded at graph.py:780. Uses same threshold as CONFIDENCE_THRESHOLDS high_min (0.7). Should be kept in sync with confidence classification threshold.,uncalibrated,registered_decision_status,baseline_measurement,not_calibrated,team-scoring,until_recalibration_trigger,metric_formula_dataset_or_threshold_change,False
agents.graph.fallback_business_impact,graph_fallback_biz_impact,0.5,score_or_threshold,fallback_policy,internal-decision-inventory-2026-06-17,nvidia-corpus-versioned,product-final-proof,"src/agents/graph.py :: _GAP_IMPACT_MAP.get(gap_name, 0.5)",workspace,not_recorded,"Fallback business impact value when gap is not in predefined map. Hardcoded at graph.py:720. Middle of GAP_BUSINESS_IMPACT_MAP range [0.4, 0.9]. Conservative default: assumes unknown gap has moderate impact.",uncalibrated,registered_decision_status,baseline_measurement,not_calibrated,team-scoring,until_recalibration_trigger,metric_formula_dataset_or_threshold_change,False
agents.graph.fallback_complexity,graph_fallback_complexity,0.5,score_or_threshold,fallback_policy,internal-decision-inventory-2026-06-17,nvidia-corpus-versioned,product-final-proof,"src/agents/graph.py :: _TECH_COMPLEXITY_MAP.get(tech_name, 0.5)",workspace,not_recorded,"Fallback implementation complexity when tech is not in predefined map. Hardcoded at graph.py:724. Middle of complexity range [0.0, 1.0]. Conservative: assumes unknown tech has moderate complexity.",uncalibrated,registered_decision_status,baseline_measurement,not_calibrated,team-scoring,until_recalibration_trigger,metric_formula_dataset_or_threshold_change,False
agents.graph.default_source_quality_score,graph_default_source_quality,0.5,score_or_threshold,fallback_policy,internal-decision-inventory-2026-06-17,nvidia-corpus-versioned,product-final-proof,"src/agents/graph.py :: item.get('source_quality_score', 0.5)",workspace,not_recorded,"Default quality score for evidence items when not provided. Hardcoded at graph.py:809. Middle of SOURCE_QUALITY_SCORES range [0.4, 1.0]. Below median of source types (median=0.65 between job_post=0.5 and blog=0.6).",uncalibrated,registered_decision_status,baseline_measurement,not_calibrated,team-scoring,until_recalibration_trigger,metric_formula_dataset_or_threshold_change,False
rag.top_k,rag_top_k,5.0,score_or_threshold,limit,internal-decision-inventory-2026-06-17,nvidia-corpus-versioned,product-final-proof,src/evaluation/rag_baseline.py :: grid_search_baseline,workspace,"Grid search (N=21 golden queries, 5 candidates: top_k=3,5,8,10,15) via src/evaluation/rag_baseline.py :: run_full_calibration. Dataset: data/eval/golden_baseline_rag.json (19 with expected sources, 2 negative tests). Added 5 keyword-based multi-source queries (kw_inference=3 sources, kw_production=4, kw_open_source=4, kw_latency=4, kw_model=8). Targets: recall>=0.85, precision>=0.4, citation>=0.95. Results: top_k=3 achieves recall=0.8092, precision=1.0, citation=1.0, unsupported_claim_rate=0.1726. At top_k=15: recall=1.0, precision=0.4772, citation=1.0, unsupported=0.0. Recommended top_k=5 (smallest meeting all targets: recall=0.8794, precision=0.9895). Citation precision is always 1.0 in golden set (all corpus chunks have source_id and url). Calibrated 2026-06-17.","Calibrated via grid search on 21 golden queries (19 with expected sources, 16 single-source, 2 gap-based multi-source, 5 keyword multi-source). top_k=5 is the smallest value meeting recall>=0.85 (got 0.8794), precision>=0.4 (got 0.9895), citation>=0.95 (got 1.0). At top_k=3: recall=0.8092 (now below 0.85 target due to 5 new multi-source queries). Top_k=15 gives perfect recall (1.0) but lower precision (0.4772). trade-off: higher top_k increases recall but decreases precision.",baseline_measured,registered_decision_status,grid_search,2026-06-17,team-rag,until_recalibration_trigger,metric_formula_dataset_or_threshold_change,True
rag.min_required_contexts,rag_min_required_contexts,1.0,score_or_threshold,limit,internal-decision-inventory-2026-06-17,nvidia-corpus-versioned,product-final-proof,src/evaluation/rag_baseline.py :: _recommend_min_required_contexts,workspace,"Grid search (N=21 golden queries, 5 candidates: top_k=3,5,8,10,15) via src/evaluation/rag_baseline.py :: run_full_calibration. Dataset: data/eval/golden_baseline_rag.json (19 with expected sources, 2 negative tests). Added 5 keyword-based multi-source queries (kw_inference=3 sources, kw_production=4, kw_open_source=4, kw_latency=4, kw_model=8). Targets: recall>=0.85, precision>=0.4, citation>=0.95. Results: top_k=3 achieves recall=0.8092, precision=1.0, citation=1.0, unsupported_claim_rate=0.1726. At top_k=15: recall=1.0, precision=0.4772, citation=1.0, unsupported=0.0. Recommended top_k=5 (smallest meeting all targets: recall=0.8794, precision=0.9895). Citation precision is always 1.0 in golden set (all corpus chunks have source_id and url). Calibrated 2026-06-17.","Derived from p50 of relevant_context_count across 19 cases with expected sources at recommended top_k=5. Distribution: p25=1, p50=1, min=1, p75=2, max=5. All single-source queries have relevant_context_count=1. Multi-source queries at top_k=5: kw_inference gets 2/3 sources; kw_production gets 4/4 sources; kw_model gets 5/8 sources.",baseline_measured,registered_decision_status,percentile_rule,2026-06-17,team-rag,until_recalibration_trigger,metric_formula_dataset_or_threshold_change,True
rag.citation_precision_threshold,rag_citation_precision_threshold,0.95,score_or_threshold,threshold,internal-decision-inventory-2026-06-17,nvidia-corpus-versioned,product-final-proof,src/evaluation/rag_baseline.py :: _recommend_top_k,workspace,"Grid search (N=21 golden queries, 5 candidates: top_k=3,5,8,10,15) via src/evaluation/rag_baseline.py :: run_full_calibration. Dataset: data/eval/golden_baseline_rag.json (19 with expected sources, 2 negative tests). Added 5 keyword-based multi-source queries (kw_inference=3 sources, kw_production=4, kw_open_source=4, kw_latency=4, kw_model=8). Targets: recall>=0.85, precision>=0.4, citation>=0.95. Results: top_k=3 achieves recall=0.8092, precision=1.0, citation=1.0, unsupported_claim_rate=0.1726. At top_k=15: recall=1.0, precision=0.4772, citation=1.0, unsupported=0.0. Recommended top_k=5 (smallest meeting all targets: recall=0.8794, precision=0.9895). Citation precision is always 1.0 in golden set (all corpus chunks have source_id and url). Calibrated 2026-06-17.","Observed citation_precision=1.0 across all top_k candidates on the golden set (all 50 corpus chunks have source_id+url). Threshold set at 0.95 to allow for edge cases where a single retrieved context has missing attribution. Tight threshold is justified because citation metadata is a deterministic property of the corpus, not a semantic metric.",baseline_measured,registered_decision_status,baseline_measurement,2026-06-17,team-rag,until_recalibration_trigger,metric_formula_dataset_or_threshold_change,True
rag.unsupported_claim_rate_threshold,rag_unsupported_claim_rate_threshold,0.1,score_or_threshold,threshold,internal-decision-inventory-2026-06-17,nvidia-corpus-versioned,product-final-proof,src/evaluation/rag_baseline.py :: _recommend_top_k,workspace,"Grid search (N=21 golden queries, 5 candidates: top_k=3,5,8,10,15) via src/evaluation/rag_baseline.py :: run_full_calibration. Dataset: data/eval/golden_baseline_rag.json (19 with expected sources, 2 negative tests). Added 5 keyword-based multi-source queries (kw_inference=3 sources, kw_production=4, kw_open_source=4, kw_latency=4, kw_model=8). Targets: recall>=0.85, precision>=0.4, citation>=0.95. Results: top_k=3 achieves recall=0.8092, precision=1.0, citation=1.0, unsupported_claim_rate=0.1726. At top_k=15: recall=1.0, precision=0.4772, citation=1.0, unsupported=0.0. Recommended top_k=5 (smallest meeting all targets: recall=0.8794, precision=0.9895). Citation precision is always 1.0 in golden set (all corpus chunks have source_id and url). Calibrated 2026-06-17.",Observed unsupported_claim_rate=0.1091 at recommended top_k=5 (slightly above 0.10 threshold due to multi-source queries with partial recall). At top_k=5: 15/19 queries have unsupported_claim_rate=0.0; 4 multi-source queries have unsupported_rate>0 (expected sources not fully retrieved). Threshold at 0.10 still provides useful signal — will be monitored and may need adjustment after more corpus growth.,baseline_measured,registered_decision_status,baseline_measurement,2026-06-17,team-rag,until_recalibration_trigger,metric_formula_dataset_or_threshold_change,True
scraping.max_sources,scraping_max_sources,3.0,score_or_threshold,limit,internal-decision-inventory-2026-06-17,nvidia-corpus-versioned,product-final-proof,src/evaluation/scraping_baseline.py :: _recommend_max_sources,workspace,"Baseline evaluation (N=11 startups: 8 fictional + 3 real) via src/evaluation/scraping_baseline.py :: run_full_calibration. Dataset: data/eval/golden_scraping_baseline.json. Real startups: Maritaca AI, Silex, Gupy. SourceCollector (src/scraping/collector.py) validated against real startups: precision=1.0, recall=0.45, F1=0.625 on 3 real startups (11 expected categories, 5 found, 0 false positives). CatScore formula: norm(claim_yield) + norm(evidence_yield) - norm(failure_rate) - norm(duplicate_rate) - norm(latency) - norm(compliance_block_rate). Calibrated 2026-06-17 via real SourceCollector + golden set.","Recommended via grid search (N=11, ranks 1..8) with coverage_target=0.85. Smallest max_sources achieving coverage>=85% is 3 (got 0.8846). Marginal gain from 3→4 is 7.69% (still useful), but 3 sources cover 88% of claims. Currently hardcoded as DISCOVERY_MAX_SOURCES=10 — should be reduced to 3. Next best action: update params.py.",baseline_measured,registered_decision_status,baseline_measurement,2026-06-17,team-scraping,until_recalibration_trigger,metric_formula_dataset_or_threshold_change,True
scraping.max_depth,scraping_max_depth,1.0,score_or_threshold,limit,internal-decision-inventory-2026-06-17,nvidia-corpus-versioned,product-final-proof,src/evaluation/scraping_baseline.py :: _recommend_max_depth,workspace,"Baseline evaluation (N=11 startups: 8 fictional + 3 real) via src/evaluation/scraping_baseline.py :: run_full_calibration. Dataset: data/eval/golden_scraping_baseline.json. Real startups: Maritaca AI, Silex, Gupy. SourceCollector (src/scraping/collector.py) validated against real startups: precision=1.0, recall=0.45, F1=0.625 on 3 real startups (11 expected categories, 5 found, 0 false positives). CatScore formula: norm(claim_yield) + norm(evidence_yield) - norm(failure_rate) - norm(duplicate_rate) - norm(latency) - norm(compliance_block_rate). Calibrated 2026-06-17 via real SourceCollector + golden set.",Recommended via marginal_evidence_gain >= 5%. Depth 0 yields 33 total evidence; depth 1 yields 70 (+112% gain). Depth 2 yields no additional gain. Recommended max_depth=1. Currently hardcoded as MAX_SEARCH_DEPTH=2 — reduction from 2 to 1 is safe. Next best action: update params.py.,baseline_measured,registered_decision_status,baseline_measurement,2026-06-17,team-scraping,until_recalibration_trigger,metric_formula_dataset_or_threshold_change,True
scraping.source_priority,scraping_source_priority,official_website > github_or_code > nvidia_or_partner_ecosystem > jobs > funding_news > technical_docs > ecosystem_directory > media,text,source_priority,internal-decision-inventory-2026-06-17,nvidia-corpus-versioned,product-final-proof,src/evaluation/scraping_baseline.py :: compute_source_category_scores,workspace,"Baseline evaluation (N=11 startups: 8 fictional + 3 real) via src/evaluation/scraping_baseline.py :: run_full_calibration. Dataset: data/eval/golden_scraping_baseline.json. Real startups: Maritaca AI, Silex, Gupy. SourceCollector (src/scraping/collector.py) validated against real startups: precision=1.0, recall=0.45, F1=0.625 on 3 real startups (11 expected categories, 5 found, 0 false positives). CatScore formula: norm(claim_yield) + norm(evidence_yield) - norm(failure_rate) - norm(duplicate_rate) - norm(latency) - norm(compliance_block_rate). Calibrated 2026-06-17 via real SourceCollector + golden set.","Derived via MCDA formula from 11-startup golden set + real collector validation (precision=1.0). Scores: official_website=1.75, github=1.24, nvidia_eco=1.07, jobs=0.32, funding_news=-0.28, technical_docs=-0.52, ecosystem_directory=-0.86, media=-1.79. High-latency sources (media, docs) penalized. Low-duplicate sources (github, nvidia) rewarded.",baseline_measured,registered_decision_status,multi_criteria_decision_analysis,2026-06-17,team-scraping,until_recalibration_trigger,metric_formula_dataset_or_threshold_change,True
evidence.min_evidence_per_claim,evidence_min_evidence_per_claim,1.0,score_or_threshold,limit,internal-decision-inventory-2026-06-17,nvidia-corpus-versioned,product-final-proof,src/evaluation/scraping_baseline.py :: _compute_supported_claim_distribution,workspace,"Baseline evaluation (N=11 startups: 8 fictional + 3 real) via src/evaluation/scraping_baseline.py :: run_full_calibration. Dataset: data/eval/golden_scraping_baseline.json. Real startups: Maritaca AI, Silex, Gupy. SourceCollector (src/scraping/collector.py) validated against real startups: precision=1.0, recall=0.45, F1=0.625 on 3 real startups (11 expected categories, 5 found, 0 false positives). CatScore formula: norm(claim_yield) + norm(evidence_yield) - norm(failure_rate) - norm(duplicate_rate) - norm(latency) - norm(compliance_block_rate). Calibrated 2026-06-17 via real SourceCollector + golden set.","Derived from p50 of evidence-per-claim distribution across 11-startup golden set at recommended max_sources=3. Distribution: min=5, p50=6, max=9. Recommended minimum=1 (conservative — ensures at least 1 evidence per claim).",baseline_measured,registered_decision_status,percentile_rule,2026-06-17,team-scraping,until_recalibration_trigger,metric_formula_dataset_or_threshold_change,True
collection.stop_condition,collection_stop_condition,marginal_gain < 3% or coverage >= 85%,text,fallback_policy,internal-decision-inventory-2026-06-17,nvidia-corpus-versioned,product-final-proof,src/evaluation/scraping_baseline.py :: _recommend_stop_condition,workspace,"Baseline evaluation (N=11 startups: 8 fictional + 3 real) via src/evaluation/scraping_baseline.py :: run_full_calibration. Dataset: data/eval/golden_scraping_baseline.json. Real startups: Maritaca AI, Silex, Gupy. SourceCollector (src/scraping/collector.py) validated against real startups: precision=1.0, recall=0.45, F1=0.625 on 3 real startups (11 expected categories, 5 found, 0 false positives). CatScore formula: norm(claim_yield) + norm(evidence_yield) - norm(failure_rate) - norm(duplicate_rate) - norm(latency) - norm(compliance_block_rate). Calibrated 2026-06-17 via real SourceCollector + golden set.","Stop condition = hybrid of supported_claim_coverage >= 85%, marginal_gain < 3%, and uncertainty_remaining=0.017. Validated at max_sources=3: coverage=0.88 (above 85%). Marginal gain from 3→4 is 7.69% (above 3% min). Practical stop: at max_sources=3, stop if 3 sources collected or coverage >= 85%, whichever comes first.",baseline_measured,registered_decision_status,cost_benefit_model,2026-06-17,team-scraping,until_recalibration_trigger,metric_formula_dataset_or_threshold_change,True
collection.http_timeout_seconds,collection_http_timeout_seconds,15.0,score_or_threshold,limit,internal-decision-inventory-2026-06-17,nvidia-corpus-versioned,product-final-proof,src/evaluation/scraping_baseline.py :: validated from src/scraping/collector.py :: _REQUEST_TIMEOUT = 15,workspace,"Derived from existing production code in src/scraping/collector.py (line 30: _REQUEST_TIMEOUT=15, line 138: max_retries from rate_limit_policy, line 168: backoff=2**attempt). Values match existing SourceCollector behavior validated against golden set (N=11 startups: 8 fictional + 3 real). Real startups: Maritaca AI, Silex, Gupy. Calibrated 2026-06-17 via HttpSourceCollector.",HTTP request timeout for source collection. Derived from existing SourceCollector._REQUEST_TIMEOUT=15. Validated against golden set: all fetchable sources respond within 5s; 15s provides 3x safety margin for rate-limited sources. Next best action: validate against production latency distribution.,baseline_measured,registered_decision_status,baseline_measurement,2026-06-17,team-scraping,until_recalibration_trigger,metric_formula_dataset_or_threshold_change,True
collection.http_max_retries,collection_http_max_retries,3.0,score_or_threshold,limit,internal-decision-inventory-2026-06-17,nvidia-corpus-versioned,product-final-proof,src/evaluation/scraping_baseline.py :: validated from src/scraping/rate_limit_policy.py :: RateLimitPolicy.max_retries = 3,workspace,"Derived from existing production code in src/scraping/collector.py (line 30: _REQUEST_TIMEOUT=15, line 138: max_retries from rate_limit_policy, line 168: backoff=2**attempt). Values match existing SourceCollector behavior validated against golden set (N=11 startups: 8 fictional + 3 real). Real startups: Maritaca AI, Silex, Gupy. Calibrated 2026-06-17 via HttpSourceCollector.",Maximum retry attempts per source fetch. Matches default max_retries=3 in rate_limit_policy. Retry only on server errors (5xx) or connection errors; client errors (4xx) are not retried. Next best action: validate retry effectiveness against golden set.,baseline_measured,registered_decision_status,baseline_measurement,2026-06-17,team-scraping,until_recalibration_trigger,metric_formula_dataset_or_threshold_change,True
collection.http_backoff_base_seconds,collection_http_backoff_base_seconds,2.0,score_or_threshold,limit,internal-decision-inventory-2026-06-17,nvidia-corpus-versioned,product-final-proof,src/evaluation/scraping_baseline.py :: validated from src/scraping/collector.py :: _fetch_with_retry :: time.sleep(2**attempt),workspace,"Derived from existing production code in src/scraping/collector.py (line 30: _REQUEST_TIMEOUT=15, line 138: max_retries from rate_limit_policy, line 168: backoff=2**attempt). Values match existing SourceCollector behavior validated against golden set (N=11 startups: 8 fictional + 3 real). Real startups: Maritaca AI, Silex, Gupy. Calibrated 2026-06-17 via HttpSourceCollector.","Base seconds for exponential backoff: sleep(base * 2^(attempt-1)). Derived from existing SourceCollector._fetch_with_retry pattern (time.sleep(2**attempt)). At attempt 1: 2s, attempt 2: 4s, attempt 3: 8s. Next best action: validate backoff distribution against real fetch latency.",baseline_measured,registered_decision_status,baseline_measurement,2026-06-17,team-scraping,until_recalibration_trigger,metric_formula_dataset_or_threshold_change,True
weight.source_quality_score.weights,source_quality_score_weights,"{""compliance_status"": 0.1, ""content_bytes"": 0.05, ""duplicate_status"": 0.05, ""extraction_success"": 0.1, ""fetch_success"": 0.15, ""latency_ms"": 0.05, ""robots_allowed"": 0.1, ""source_authority_prior"": 0.3, ""source_freshness_days"": 0.05, ""source_independence_type"": 0.05}",weight_set,weight,internal-decision-inventory-2026-06-17,nvidia-corpus-versioned,product-final-proof,source_evidence_score_baseline_eval,workspace,"src/evaluation/source_evidence_baseline.py :: run_full_calibration — 5 weight candidates via grid search on 95 golden entries (derived from data/eval/golden_scraping_baseline.json). Labels derived from source features. Winner: candidate 0 (default weights) — spearman=0.87, mae=0.17. SQ meets production criteria: spearman>0.5, mae<0.2, >=50 labeled entries. Full report: run_full_calibration() -> report.","Per-feature weights for source quality scoring. Calibrated via grid_search on 95 entries (source_evidence_score_baseline_eval). Labels derived deterministically from scraping baseline features. Best candidate (idx 0): spearman=0.8696, mae=0.1721, rmse=0.1908. Weights sum to 1.0. source_authority_prior (0.30) and fetch_success (0.15) are the dominant features. Calibration status: BASELINE_MEASURED, production_allowed=True. EC remains blocked — see threshold.evidence_confidence_score.production_min.",baseline_measured,registered_decision_status,grid_search,2026-06-18,team-scoring,until_recalibration_trigger,metric_formula_dataset_or_threshold_change,True
