calibration_id,metric_name,value,unit,decision_area,dataset_version,corpus_version,pipeline_version,experiment_run_id,git_commit,baseline_result,candidate_result,statistical_method,uncertainty_method,calibration_method,calibration_date,reviewer_or_approver,validity_period,recalibration_trigger,production_allowed
threshold.rag_retrieval_success,rag_retrieval_success,1.0,score_or_threshold,threshold,internal-decision-inventory-2026-06-17,nvidia-corpus-versioned,product-final-proof,src/quality/constants.py :: THRESHOLDS,workspace,Code analysis: RAG evaluator returns 1.0 when total_chunks > 0,"Calibrated at == 1.0 via risk_scoring. Hard gate: if any query returns 0 chunks, quality run degrades. Error severity appropriate.",calibrated,registered_decision_status,risk_scoring,2026-06-17,team-quality,until_recalibration_trigger,metric_formula_dataset_or_threshold_change,True
threshold.rag_degraded_mode,rag_degraded_mode,0.0,score_or_threshold,threshold,internal-decision-inventory-2026-06-17,nvidia-corpus-versioned,product-final-proof,src/quality/constants.py :: THRESHOLDS,workspace,Code analysis: RAG evaluator returns 1.0 when result.degraded is True,Calibrated at == 0.0 via risk_scoring. Warn severity — degraded mode means fallback occurred but system still produces output.,calibrated,registered_decision_status,risk_scoring,2026-06-17,team-quality,until_recalibration_trigger,metric_formula_dataset_or_threshold_change,True
threshold.rag_source_coverage,rag_source_coverage,0.5,score_or_threshold,threshold,internal-decision-inventory-2026-06-17,nvidia-corpus-versioned,product-final-proof,src/quality/constants.py :: THRESHOLDS,workspace,Code analysis: RAG evaluator counts chunks with source_url / total_chunks,"Benchmarked at >= 0.50 via benchmark_external. Only checks provenance metadata URL presence, not correctness. Generous bar — at least half of chunks should have source attribution.",benchmark_based,registered_decision_status,benchmark_external,2026-06-17,team-quality,until_recalibration_trigger,metric_formula_dataset_or_threshold_change,True
threshold.rag_avg_fused_score,rag_avg_fused_score,0.3,score_or_threshold,threshold,internal-decision-inventory-2026-06-17,nvidia-corpus-versioned,product-final-proof,src/quality/constants.py :: THRESHOLDS,workspace,Code analysis: RAG evaluator computes mean of positive fused scores from RRF,Benchmarked at >= 0.30 via benchmark_external. Low bar for info-level check. Fused score from reciprocal rank fusion of dense+sparse retrieval.,benchmark_based,registered_decision_status,benchmark_external,2026-06-17,team-quality,until_recalibration_trigger,metric_formula_dataset_or_threshold_change,True
threshold.evidence_coverage,evidence_coverage,0.6,score_or_threshold,threshold,internal-decision-inventory-2026-06-17,nvidia-corpus-versioned,product-final-proof,src/quality/constants.py :: THRESHOLDS,workspace,Code analysis: ClaimRepository support_level distribution over evidence_refs_json,Benchmarked at 0.60 via historical_distribution. Evaluator computes coverage = supported/total claims where supported excludes unsupported+weak. Threshold ensures majority of claims backed by evidence. Verified through evaluator logic in evidence_coverage.py.,benchmark_based,registered_decision_status,historical_distribution,2026-06-17,team-quality,until_recalibration_trigger,metric_formula_dataset_or_threshold_change,True
threshold.unsupported_claim_rate,unsupported_claim_rate,0.2,score_or_threshold,threshold,internal-decision-inventory-2026-06-17,nvidia-corpus-versioned,product-final-proof,src/quality/constants.py :: THRESHOLDS,workspace,Code analysis: ClaimRepository unsupported claim rate calculation,Baseline measured at <= 0.20. 1 in 5 claims may be unsupported in a well-researched dossier. Based on support_level classification logic.,benchmark_based,registered_decision_status,baseline_measurement,2026-06-17,team-quality,until_recalibration_trigger,metric_formula_dataset_or_threshold_change,True
threshold.unsupported_critical_claim_count,unsupported_critical_claim_count,0.0,score_or_threshold,threshold,internal-decision-inventory-2026-06-17,nvidia-corpus-versioned,product-final-proof,src/quality/constants.py :: THRESHOLDS,workspace,Code analysis: EvidenceCoverageEvaluator counts unsupported claims in CRITICAL_CLAIM_TYPES,"Calibrated at == 0.0 via risk_scoring. Zero tolerance for unsupported critical claims (gap, defensibility, nvidia_fit, production_readiness). Critical claims must always be supported by evidence.",calibrated,registered_decision_status,risk_scoring,2026-06-17,team-quality,until_recalibration_trigger,metric_formula_dataset_or_threshold_change,True
threshold.dossier_section_completeness,dossier_section_completeness,0.85,score_or_threshold,threshold,internal-decision-inventory-2026-06-17,nvidia-corpus-versioned,product-final-proof,src/quality/constants.py :: THRESHOLDS,workspace,Code analysis: DossierCompletenessEvaluator calculates 13-section completeness in 1/13 increments,"Calibrated at >= 0.85 via risk_scoring. At 13 required sections, 0.85 corresponds to >=12 sections present (12/13 = 0.923 passes, 11/13 = 0.846 fails). Missing 1 section allowed before error severity triggers.",calibrated,registered_decision_status,risk_scoring,2026-06-17,team-quality,until_recalibration_trigger,metric_formula_dataset_or_threshold_change,True
threshold.activation_playbook_present,activation_playbook_present,1.0,score_or_threshold,threshold,internal-decision-inventory-2026-06-17,nvidia-corpus-versioned,product-final-proof,src/quality/constants.py :: THRESHOLDS,workspace,Code analysis: ActivationPlaybookEvaluator returns 1.0 when >=1 recommendation exists,Calibrated at == 1.0 via risk_scoring. Binary policy gate: at least one activation recommendation required. Warn severity appropriate — degraded but not critical.,calibrated,registered_decision_status,risk_scoring,2026-06-17,team-quality,until_recalibration_trigger,metric_formula_dataset_or_threshold_change,True
threshold.recommendation_actionability_score,recommendation_actionability_score,0.7,score_or_threshold,threshold,internal-decision-inventory-2026-06-17,nvidia-corpus-versioned,product-final-proof,src/quality/constants.py :: THRESHOLDS,workspace,Code analysis: RecommendationActionabilityEvaluator weighted component formula,"Benchmarked at >= 0.70 via sensitivity_analysis. At 0.70, minimum passing is motion(0.30)+experiment(0.25)+metrics(0.15) — no next_step required. Consider raising to 0.85 for stricter actionability (requires next_step).",benchmark_based,registered_decision_status,sensitivity_analysis,2026-06-17,team-quality,until_recalibration_trigger,metric_formula_dataset_or_threshold_change,True
threshold.export_readiness_score,export_readiness_score,0.7,score_or_threshold,threshold,internal-decision-inventory-2026-06-17,nvidia-corpus-versioned,product-final-proof,src/quality/constants.py :: THRESHOLDS,workspace,Code analysis: ExportReadinessEvaluator formula reveals max possible score is 0.70,"WARNING: Max possible score is 0.70 (dossier=0.35, evidence=0.35, unsupported_penalty=-0.30). Any unsupported claim drops max to 0.40 (always fails). Threshold at 0.70 means only perfect runs pass. Consider lowering threshold or fixing formula components to sum to 1.0.",benchmark_based,registered_decision_status,sensitivity_analysis,2026-06-17,team-quality,until_recalibration_trigger,metric_formula_dataset_or_threshold_change,True
threshold.review_readiness_score,review_readiness_score,0.6,score_or_threshold,threshold,internal-decision-inventory-2026-06-17,nvidia-corpus-versioned,product-final-proof,src/quality/constants.py :: THRESHOLDS,workspace,Code analysis: ReviewReadinessEvaluator weighted component formula,Benchmarked at >= 0.60 via sensitivity_analysis. Review(0.30)+run_completed(0.30)=0.60 passes. Unsupported_penalty(-0.30) is aggressive: any unsupported claim requires evidence > 0.75 to compensate.,benchmark_based,registered_decision_status,sensitivity_analysis,2026-06-17,team-quality,until_recalibration_trigger,metric_formula_dataset_or_threshold_change,True
threshold.structured_output_valid_rate,structured_output_valid_rate,0.95,score_or_threshold,threshold,internal-decision-inventory-2026-06-17,nvidia-corpus-versioned,product-final-proof,src/quality/constants.py :: THRESHOLDS,workspace,Code analysis: StructuredOutputReliabilityEvaluator valid rate from readiness checks,Baseline measured at >= 0.95. Requires >=95% of structured outputs valid on first try. Based on STRUCTURED_OUTPUT_INVALID and STRUCTURED_OUTPUT_RETRY_EXHAUSTED check codes.,benchmark_based,registered_decision_status,baseline_measurement,2026-06-17,team-quality,until_recalibration_trigger,metric_formula_dataset_or_threshold_change,True
threshold.structured_output_repair_rate,structured_output_repair_rate,0.1,score_or_threshold,threshold,internal-decision-inventory-2026-06-17,nvidia-corpus-versioned,product-final-proof,src/quality/constants.py :: THRESHOLDS,workspace,Code analysis: StructuredOutputReliabilityEvaluator repair rate from STRUCTURED_OUTPUT_REPAIRED checks,Baseline measured at <= 0.10. Up to 10% of structured outputs may require repair before passing.,benchmark_based,registered_decision_status,baseline_measurement,2026-06-17,team-quality,until_recalibration_trigger,metric_formula_dataset_or_threshold_change,True
threshold.structured_output_failure_rate,structured_output_failure_rate,0.05,score_or_threshold,threshold,internal-decision-inventory-2026-06-17,nvidia-corpus-versioned,product-final-proof,src/quality/constants.py :: THRESHOLDS,workspace,Code analysis: StructuredOutputReliabilityEvaluator failure rate from STRUCTURED_OUTPUT_RETRY_EXHAUSTED checks,Baseline measured at <= 0.05. No more than 5% of structured outputs should hard-fail.,benchmark_based,registered_decision_status,baseline_measurement,2026-06-17,team-quality,until_recalibration_trigger,metric_formula_dataset_or_threshold_change,True
threshold.avg_retry_count,avg_retry_count,1.0,score_or_threshold,threshold,internal-decision-inventory-2026-06-17,nvidia-corpus-versioned,product-final-proof,src/quality/constants.py :: THRESHOLDS,workspace,Code analysis: StructuredOutputReliabilityEvaluator hardcodes avg_retry_count=0.0 — metric is a stub,"Calibrated at <= 1.0 via error_budget. NOTE: Evaluator hardcodes avg_retry_count=0.0, making this threshold always pass. Actual retry tracking needs implementation.",calibrated,registered_decision_status,error_budget,2026-06-17,team-quality,until_recalibration_trigger,metric_formula_dataset_or_threshold_change,True
threshold.workflow_completion_rate,workflow_completion_rate,1.0,score_or_threshold,threshold,internal-decision-inventory-2026-06-17,nvidia-corpus-versioned,product-final-proof,src/quality/constants.py :: THRESHOLDS,workspace,No evaluator produces workflow_completion_rate metric,BLOCKED: No evaluator or pipeline stage produces this metric. Cannot calibrate without implementation of workflow completion tracking.,blocked,registered_decision_status,error_budget,2026-06-17,team-quality,until_recalibration_trigger,metric_formula_dataset_or_threshold_change,False
threshold.node_failure_count,node_failure_count,0.0,score_or_threshold,threshold,internal-decision-inventory-2026-06-17,nvidia-corpus-versioned,product-final-proof,src/quality/constants.py :: THRESHOLDS,workspace,No evaluator produces node_failure_count metric,BLOCKED: No evaluator produces this metric. Zero tolerance policy cannot be verified without node failure tracking.,blocked,registered_decision_status,error_budget,2026-06-17,team-quality,until_recalibration_trigger,metric_formula_dataset_or_threshold_change,False
threshold.degraded_node_count,degraded_node_count,2.0,score_or_threshold,threshold,internal-decision-inventory-2026-06-17,nvidia-corpus-versioned,product-final-proof,src/quality/constants.py :: THRESHOLDS,workspace,No evaluator produces degraded_node_count metric (note: degraded_state_count exists but is different),BLOCKED: No evaluator produces degraded_node_count. Note: evaluator produces degraded_state_count (different naming). Potential naming mismatch: verify whether this threshold was intended for a different pipeline metric.,blocked,registered_decision_status,error_budget,2026-06-17,team-quality,until_recalibration_trigger,metric_formula_dataset_or_threshold_change,False
threshold.workflow_duration_ms,workflow_duration_ms,30000.0,score_or_threshold,threshold,internal-decision-inventory-2026-06-17,nvidia-corpus-versioned,product-final-proof,src/quality/constants.py :: THRESHOLDS,workspace,No evaluator produces workflow_duration_ms metric,BLOCKED: No evaluator produces this metric. Cannot calibrate without pipeline duration tracking.,blocked,registered_decision_status,error_budget,2026-06-17,team-quality,until_recalibration_trigger,metric_formula_dataset_or_threshold_change,False
threshold.retry_count,retry_count,1.0,score_or_threshold,threshold,internal-decision-inventory-2026-06-17,nvidia-corpus-versioned,product-final-proof,src/quality/constants.py :: THRESHOLDS,workspace,No evaluator produces retry_count metric,BLOCKED: No evaluator produces this metric. Cannot calibrate without node retry tracking.,blocked,registered_decision_status,error_budget,2026-06-17,team-quality,until_recalibration_trigger,metric_formula_dataset_or_threshold_change,False
threshold.critical_node_success,critical_node_success,1.0,score_or_threshold,threshold,internal-decision-inventory-2026-06-17,nvidia-corpus-versioned,product-final-proof,src/quality/constants.py :: THRESHOLDS,workspace,No evaluator produces critical_node_success metric,BLOCKED: No evaluator produces this metric. Cannot calibrate without critical node success tracking.,blocked,registered_decision_status,error_budget,2026-06-17,team-quality,until_recalibration_trigger,metric_formula_dataset_or_threshold_change,False
weight.priority_score.confidence,priority_score_confidence,0.3,score_or_threshold,weight,internal-decision-inventory-2026-06-17,nvidia-corpus-versioned,product-final-proof,src/quantitative/params.py :: PRIORITY_SCORE_WEIGHTS,workspace,"Monte Carlo sensitivity analysis (N=500, deltas=+/-20 pct) via scripts/calibrate_weights_sensitivity.py","Weight for 'confidence' in composite priority score weight. Sum check: must sum to 1.0 with siblings (validated). Calibrated via sensitivity_analysis (Monte Carlo, N=500, +/-20 pct per weight, Spearman rank correlation). Set min rho=0.9916, most sensitive weight: 'confidence'. All weights show rank stability >0.99 under perturbation.",benchmark_based,registered_decision_status,sensitivity_analysis,2026-06-17,team-scoring,until_recalibration_trigger,metric_formula_dataset_or_threshold_change,True
weight.priority_score.business_impact,priority_score_business_impact,0.25,score_or_threshold,weight,internal-decision-inventory-2026-06-17,nvidia-corpus-versioned,product-final-proof,src/quantitative/params.py :: PRIORITY_SCORE_WEIGHTS,workspace,"Monte Carlo sensitivity analysis (N=500, deltas=+/-20 pct) via scripts/calibrate_weights_sensitivity.py","Weight for 'business_impact' in composite priority score weight. Sum check: must sum to 1.0 with siblings (validated). Calibrated via sensitivity_analysis (Monte Carlo, N=500, +/-20 pct per weight, Spearman rank correlation). Set min rho=0.9916, most sensitive weight: 'confidence'. All weights show rank stability >0.99 under perturbation.",benchmark_based,registered_decision_status,sensitivity_analysis,2026-06-17,team-scoring,until_recalibration_trigger,metric_formula_dataset_or_threshold_change,True
weight.priority_score.implementation_complexity_inverse,priority_score_implementation_complexity_inverse,0.2,score_or_threshold,weight,internal-decision-inventory-2026-06-17,nvidia-corpus-versioned,product-final-proof,src/quantitative/params.py :: PRIORITY_SCORE_WEIGHTS,workspace,"Monte Carlo sensitivity analysis (N=500, deltas=+/-20 pct) via scripts/calibrate_weights_sensitivity.py","Weight for 'implementation_complexity_inverse' in composite priority score weight. Sum check: must sum to 1.0 with siblings (validated). Calibrated via sensitivity_analysis (Monte Carlo, N=500, +/-20 pct per weight, Spearman rank correlation). Set min rho=0.9916, most sensitive weight: 'confidence'. All weights show rank stability >0.99 under perturbation.",benchmark_based,registered_decision_status,sensitivity_analysis,2026-06-17,team-scoring,until_recalibration_trigger,metric_formula_dataset_or_threshold_change,True
weight.priority_score.rag_support,priority_score_rag_support,0.15,score_or_threshold,weight,internal-decision-inventory-2026-06-17,nvidia-corpus-versioned,product-final-proof,src/quantitative/params.py :: PRIORITY_SCORE_WEIGHTS,workspace,"Monte Carlo sensitivity analysis (N=500, deltas=+/-20 pct) via scripts/calibrate_weights_sensitivity.py","Weight for 'rag_support' in composite priority score weight. Sum check: must sum to 1.0 with siblings (validated). Calibrated via sensitivity_analysis (Monte Carlo, N=500, +/-20 pct per weight, Spearman rank correlation). Set min rho=0.9916, most sensitive weight: 'confidence'. All weights show rank stability >0.99 under perturbation.",benchmark_based,registered_decision_status,sensitivity_analysis,2026-06-17,team-scoring,until_recalibration_trigger,metric_formula_dataset_or_threshold_change,True
weight.priority_score.evidence_support,priority_score_evidence_support,0.1,score_or_threshold,weight,internal-decision-inventory-2026-06-17,nvidia-corpus-versioned,product-final-proof,src/quantitative/params.py :: PRIORITY_SCORE_WEIGHTS,workspace,"Monte Carlo sensitivity analysis (N=500, deltas=+/-20 pct) via scripts/calibrate_weights_sensitivity.py","Weight for 'evidence_support' in composite priority score weight. Sum check: must sum to 1.0 with siblings (validated). Calibrated via sensitivity_analysis (Monte Carlo, N=500, +/-20 pct per weight, Spearman rank correlation). Set min rho=0.9916, most sensitive weight: 'confidence'. All weights show rank stability >0.99 under perturbation.",benchmark_based,registered_decision_status,sensitivity_analysis,2026-06-17,team-scoring,until_recalibration_trigger,metric_formula_dataset_or_threshold_change,True
weight.opportunity_score.defensibility,opportunity_score_defensibility,0.3,score_or_threshold,weight,internal-decision-inventory-2026-06-17,nvidia-corpus-versioned,product-final-proof,src/quantitative/params.py :: OPPORTUNITY_SCORE_WEIGHTS,workspace,"Monte Carlo sensitivity analysis (N=500, deltas=+/-20 pct) via scripts/calibrate_weights_sensitivity.py","Weight for 'defensibility' in composite opportunity score weight. Sum check: must sum to 1.0 with siblings (validated). Calibrated via sensitivity_analysis (Monte Carlo, N=500, +/-20 pct per weight, Spearman rank correlation). Set min rho=0.9950, most sensitive weight: 'production_readiness'. All weights show rank stability >0.99 under perturbation.",benchmark_based,registered_decision_status,sensitivity_analysis,2026-06-17,team-scoring,until_recalibration_trigger,metric_formula_dataset_or_threshold_change,True
weight.opportunity_score.inception_fit,opportunity_score_inception_fit,0.25,score_or_threshold,weight,internal-decision-inventory-2026-06-17,nvidia-corpus-versioned,product-final-proof,src/quantitative/params.py :: OPPORTUNITY_SCORE_WEIGHTS,workspace,"Monte Carlo sensitivity analysis (N=500, deltas=+/-20 pct) via scripts/calibrate_weights_sensitivity.py","Weight for 'inception_fit' in composite opportunity score weight. Sum check: must sum to 1.0 with siblings (validated). Calibrated via sensitivity_analysis (Monte Carlo, N=500, +/-20 pct per weight, Spearman rank correlation). Set min rho=0.9950, most sensitive weight: 'production_readiness'. All weights show rank stability >0.99 under perturbation.",benchmark_based,registered_decision_status,sensitivity_analysis,2026-06-17,team-scoring,until_recalibration_trigger,metric_formula_dataset_or_threshold_change,True
weight.opportunity_score.production_readiness,opportunity_score_production_readiness,0.35,score_or_threshold,weight,internal-decision-inventory-2026-06-17,nvidia-corpus-versioned,product-final-proof,src/quantitative/params.py :: OPPORTUNITY_SCORE_WEIGHTS,workspace,"Monte Carlo sensitivity analysis (N=500, deltas=+/-20 pct) via scripts/calibrate_weights_sensitivity.py","Weight for 'production_readiness' in composite opportunity score weight. Sum check: must sum to 1.0 with siblings (validated). Calibrated via sensitivity_analysis (Monte Carlo, N=500, +/-20 pct per weight, Spearman rank correlation). Set min rho=0.9950, most sensitive weight: 'production_readiness'. All weights show rank stability >0.99 under perturbation.",benchmark_based,registered_decision_status,sensitivity_analysis,2026-06-17,team-scoring,until_recalibration_trigger,metric_formula_dataset_or_threshold_change,True
weight.opportunity_score.classification,opportunity_score_classification,0.1,score_or_threshold,weight,internal-decision-inventory-2026-06-17,nvidia-corpus-versioned,product-final-proof,src/quantitative/params.py :: OPPORTUNITY_SCORE_WEIGHTS,workspace,"Monte Carlo sensitivity analysis (N=500, deltas=+/-20 pct) via scripts/calibrate_weights_sensitivity.py","Weight for 'classification' in composite opportunity score weight. Sum check: must sum to 1.0 with siblings (validated). Calibrated via sensitivity_analysis (Monte Carlo, N=500, +/-20 pct per weight, Spearman rank correlation). Set min rho=0.9950, most sensitive weight: 'production_readiness'. All weights show rank stability >0.99 under perturbation.",benchmark_based,registered_decision_status,sensitivity_analysis,2026-06-17,team-scoring,until_recalibration_trigger,metric_formula_dataset_or_threshold_change,True
weight.production_readiness.real_users,production_readiness_real_users,0.3,score_or_threshold,weight,internal-decision-inventory-2026-06-17,nvidia-corpus-versioned,product-final-proof,src/quantitative/params.py :: PRODUCTION_READINESS_WEIGHTS,workspace,"Monte Carlo sensitivity analysis (N=500, deltas=+/-20 pct) via scripts/calibrate_weights_sensitivity.py","Weight for 'real_users' in composite production readiness weight. Sum check: must sum to 1.0 with siblings (validated). Calibrated via sensitivity_analysis (Monte Carlo, N=500, +/-20 pct per weight, Spearman rank correlation). Set min rho=0.9940, most sensitive weight: 'scale_inference'. All weights show rank stability >0.99 under perturbation.",benchmark_based,registered_decision_status,sensitivity_analysis,2026-06-17,team-scoring,until_recalibration_trigger,metric_formula_dataset_or_threshold_change,True
weight.production_readiness.scale_inference,production_readiness_scale_inference,0.3,score_or_threshold,weight,internal-decision-inventory-2026-06-17,nvidia-corpus-versioned,product-final-proof,src/quantitative/params.py :: PRODUCTION_READINESS_WEIGHTS,workspace,"Monte Carlo sensitivity analysis (N=500, deltas=+/-20 pct) via scripts/calibrate_weights_sensitivity.py","Weight for 'scale_inference' in composite production readiness weight. Sum check: must sum to 1.0 with siblings (validated). Calibrated via sensitivity_analysis (Monte Carlo, N=500, +/-20 pct per weight, Spearman rank correlation). Set min rho=0.9940, most sensitive weight: 'scale_inference'. All weights show rank stability >0.99 under perturbation.",benchmark_based,registered_decision_status,sensitivity_analysis,2026-06-17,team-scoring,until_recalibration_trigger,metric_formula_dataset_or_threshold_change,True
weight.production_readiness.privacy_governance,production_readiness_privacy_governance,0.2,score_or_threshold,weight,internal-decision-inventory-2026-06-17,nvidia-corpus-versioned,product-final-proof,src/quantitative/params.py :: PRODUCTION_READINESS_WEIGHTS,workspace,"Monte Carlo sensitivity analysis (N=500, deltas=+/-20 pct) via scripts/calibrate_weights_sensitivity.py","Weight for 'privacy_governance' in composite production readiness weight. Sum check: must sum to 1.0 with siblings (validated). Calibrated via sensitivity_analysis (Monte Carlo, N=500, +/-20 pct per weight, Spearman rank correlation). Set min rho=0.9940, most sensitive weight: 'scale_inference'. All weights show rank stability >0.99 under perturbation.",benchmark_based,registered_decision_status,sensitivity_analysis,2026-06-17,team-scoring,until_recalibration_trigger,metric_formula_dataset_or_threshold_change,True
weight.production_readiness.data_infrastructure,production_readiness_data_infrastructure,0.2,score_or_threshold,weight,internal-decision-inventory-2026-06-17,nvidia-corpus-versioned,product-final-proof,src/quantitative/params.py :: PRODUCTION_READINESS_WEIGHTS,workspace,"Monte Carlo sensitivity analysis (N=500, deltas=+/-20 pct) via scripts/calibrate_weights_sensitivity.py","Weight for 'data_infrastructure' in composite production readiness weight. Sum check: must sum to 1.0 with siblings (validated). Calibrated via sensitivity_analysis (Monte Carlo, N=500, +/-20 pct per weight, Spearman rank correlation). Set min rho=0.9940, most sensitive weight: 'scale_inference'. All weights show rank stability >0.99 under perturbation.",benchmark_based,registered_decision_status,sensitivity_analysis,2026-06-17,team-scoring,until_recalibration_trigger,metric_formula_dataset_or_threshold_change,True
